sample_id,subject,subject_category,question,option_a,option_b,option_c,option_d,answer,required_knowledge,time_sensitive,reference,culture,region,country,cultural_sensitivity_label,is_annotated
high_school_physics/test/140,high_school_physics,STEM,त्रिज्या Q और लंबाई ℓ वाली एक बेलनाकार एल्युमीनियम की छड़ में ऊष्मा जोड़ी जाती है। छड़ के दोनों सिरों के बीच तापमान का अंतर 10°C से 20°C तक होता है। छड़ के साथ ऊष्मा के स्थानांतरण की दर को कौन से ज्यामितीय कारक प्रभावित करेंगे?,केवल लंबाई,केवल छड़ का क्षेत्रफल,लम्बाई और क्षेत्रफल दोनों,न तो लम्बाई और न ही क्षेत्रफल,C,"['none', 'regional', 'none', 'none', 'none']","['No', 'No', 'No', 'No', 'No']","['-', '-', '-', '-', '-']",[],[],[],CA,True
high_school_physics/test/147,high_school_physics,STEM,"भौतिकी के छात्र एक टेनिस बॉल के वेग को मापकर काइनेमेटिक्स के सतत त्वरण समीकरणों की जांच कर रहे हैं, जो 6 मीटर तक गिरती है और फिर एक फोटोगेट से गुजरती है. अनुमानित वेग फोटोगेट द्वारा मापे गए वेग से 20% अधिक है. निम्नलिखित में से कौन बड़े प्रतिशत अंतर के कारण का सबसे अच्छा वर्णन करता है?",गिरते समय गेंद अपना आकार बदल लेती है.,जैसे-जैसे गेंद गिरती है गुरुत्वाकर्षण का त्वरण बदलता रहता है.,वायु प्रतिरोध से गेंद का त्वरण बढ़ जाता है.,गेंदों का त्वरण वेग के साथ बदलता रहता है.,D,"['regional', 'none', 'none', 'regional']","['No', 'No', 'No', 'No']","['-', '-', '-', '-']",[],[],[],CS,True
high_school_psychology/test/82,high_school_psychology,Social Sciences,निम्नलिखित में से कौन सा दृष्टिकोण लोगों की भावनाओं के महत्व पर जोर देता है और मानव स्वभाव को स्वाभाविक रूप से सकारात्मक और विकास चाहने वाला मानता है?,जैविक,व्यवहार,संज्ञानात्मक,मानवतावादी,D,"['none', 'cultural', 'none', 'none']","['No', 'No', 'No', 'No']","['-', '-', '-', '-']",['Western Culture'],[],[],CA,True
high_school_psychology/test/168,high_school_psychology,Social Sciences,"चैंटल का कहना है कि उसकी माँ दबंग और दबंग है। चैंटल के सभी दोस्त इस बात पर सहमत हैं कि ये विशेषताएँ उसी में हैं, उसकी माँ में नहीं। फ्रायड का सुझाव है कि चैंटल का व्यवहार निम्नलिखित में से किस रक्षा तंत्र का उदाहरण है?",दमन,वापसी,प्रक्षेपण,विस्थापन,C,"['cultural', 'none', 'none', 'cultural', 'cultural']","['No', 'No', 'No', 'Yes', 'No']","['-', '-', '-', '-', '-']","['Western Culture', 'Western Culture', 'Western Culture']",['North America'],[],CS,True
high_school_psychology/test/238,high_school_psychology,Social Sciences,निम्नलिखित में से कौन सा कथन इवान पावलोव की आकस्मिक खोज को सर्वोत्तम रूप से दर्शाता है?,"चूहों पर प्रयोग करते समय पावलोव ने पाया कि यदि वे ""T-maze"" के एक ओर बार-बार भोजन की गोलियां रखेंगे, तो चूहे स्वतः ही भूलभुलैया के उसी ओर भाग जाएंगे।","कुत्तों पर प्रयोग करते समय पावलोव ने पाया कि जब उनके कुत्ते भोजन के समय भोजन लाने वाले व्यक्ति को देखने और सुनने के आदी हो गए, तो वे भोजन लाने वाले व्यक्ति को देखकर और उसकी आवाज सुनकर लार टपकाने लगे।","बिल्लियों पर प्रयोग करते समय पावलोव ने पाया कि यदि वह एक भूखी बिल्ली को एक बक्से के अंदर रख दे और बक्से के बाहर भोजन रख दे, तो बिल्ली बक्से का दरवाजा खोलने के लिए लीवर दबाना ""सीख"" सकती है।","कबूतरों पर प्रयोग करते समय पावलोव ने पाया कि यदि वह कबूतर को किसी बक्से में रख दे, तो वह उसे यह पहचानने के लिए प्रशिक्षित कर सकता है कि यदि वह किसी विशेष कुंजी पर चोंच मारे, तो उसे भोजन की एक गोली प्राप्त होगी।",B,"['cultural', 'cultural', 'none', 'none', 'regional', 'none']","['No', 'No', 'No', 'No', 'No', 'No']","['-', '-', '-', '-', '-', '-', '-']",['Other'],['Europe'],['Russian Federation'],CS,True
high_school_psychology/test/281,high_school_psychology,Social Sciences,"एक कार्टून में, एक पात्र के एक कंधे पर एक देवदूत बैठा है और दूसरे कंधे पर एक शैतान बैठा है, जिसे यह तय करना है कि बेघर आदमी को पैसे देने हैं या नहीं। शैतान कहता है, ""उसे कुछ मत दो, तुम पैसे का उससे बेहतर इस्तेमाल करोगे।"" देवदूत कहता है, ""उसे पैसे दो क्योंकि उसे तुम्हारी तुलना में इसकी ज़्यादा ज़रूरत है।"" पात्र बेघर आदमी को उसके पैसे का आधा हिस्सा देता है। फ्रायडियन व्याख्या में, देवदूत पात्र की संपत्ति का प्रतिनिधित्व करता है।",लिबिडो,इड,अहंकार,महा-अहंकार,D,"['cultural', 'none', 'cultural', 'none']","['No', 'No', 'No', 'No']","['-', '-', '-', '-']","['Western Culture', 'Western Culture']",[],[],CS,True
high_school_psychology/test/309,high_school_psychology,Social Sciences,"एक मनोवैज्ञानिक जो इस बात पर ध्यान केंद्रित करता है कि क्या विकास चरणों में होता है, वह निम्नलिखित में से किस विवाद में सबसे अधिक रुचि रखता है?",प्रकृति बनाम पालने वाला,निरंतरता बनाम असंततता,स्थिरता बनाम परिवर्तन,व्यक्तिपरकता बनाम वस्तुनिष्ठता,A,"['none', 'none', 'none', 'none']","['No', 'No', 'No', 'No']","['-', '-', '-', '-']",[],[],[],CA,True
high_school_psychology/test/314,high_school_psychology,Social Sciences,"प्रभाव के नियम के अनुसार, नकारात्मक परिणामों के बाद होने वाला व्यवहार",अधिक बार घटित होना,कम बार घटित होना,फिर कभी प्रदर्शन नहीं किया जाएगा,अधिक बलपूर्वक प्रदर्शन किया जाएगा,B,"['cultural', 'none', 'cultural', 'regional']","['No', 'No', 'No', 'No']","['-', '-', {'end': 30, 'label': 'Cultural', 'score': None, 'start': 17}, {'end': 31, 'label': 'Geographic', 'score': None, 'start': 17}]","['Western Culture', 'Western Culture']",['North America'],"['United States of America (USA)', 'United States of America (USA)']",CS,True
high_school_psychology/test/404,high_school_psychology,Social Sciences,"निम्नलिखित में से कौन सा मस्तिष्क स्कैन इस कथन को गलत साबित करने में सबसे अधिक उपयोगी होगा: ""अधिकांश लोग अपने मस्तिष्क का केवल 10 प्रतिशत ही उपयोग करते हैं""?",बिल्ली,एमआरआई,ईईजी,पालतू,D,"['none', 'none', 'none', 'none']","['No', 'No', 'No', 'No']","['-', '-', '-', '-']",[],[],[],CA,True
high_school_psychology/test/419,high_school_psychology,Social Sciences,"मस्तिष्क विकास के एक अध्ययन में, चूहों के दो समूहों को प्रयोगशाला में पाला गया। समूह I में, प्रत्येक चूहे को बिना किसी खिलौने के अलग-थलग करके पाला गया, जबकि समूह II में, चूहों को छोटे-छोटे समूहों में विभाजित किया गया और उन्हें खेलने के लिए खिलौने दिए गए। निम्नलिखित में से कौन सा कथन इस अध्ययन के संभावित निष्कर्षों को सबसे सटीक रूप से दर्शाता है?",समूह I में पाले गए चूहों के अग्रमस्तिष्क का भार समूह II में पाले गए चूहों के अग्रमस्तिष्क से अधिक होगा।,समूह I में पाले गए चूहों के अग्रमस्तिष्क का भार समूह II में पाले गए चूहों के अग्रमस्तिष्क से कम होगा।,"समूह I में पाले गए चूहों के मस्तिष्क, समूह II में पाले गए चूहों के मस्तिष्क से विशेष रूप से भिन्न नहीं होंगे।","समूह I में पाले गए चूहों के मस्तिष्क में अधिक श्वेत पदार्थ होगा, जबकि समूह II में पाले गए चूहों के मस्तिष्क में अधिक धूसर पदार्थ होगा।",B,"['none', 'none', 'none', 'none']","['No', 'No', 'No', 'No']","['-', '-', '-', '-']",[],[],[],CA,True
high_school_psychology/test/496,high_school_psychology,Social Sciences,लगभग कितने प्रतिशत जनसंख्या का WISC पर स्कोर 70 से 130 के बीच है?,34,50,68,95,D,"['regional', 'none', 'regional', 'none']","['Yes', 'No', 'Yes', 'No']","['-', '-', '-', '-']",[],[],['United States of America (USA)'],CS,True
high_school_psychology/test/501,high_school_psychology,Social Sciences,"मस्तिष्क की ओर जाते समय, दोनों आँखों की रेटिना से सूचना किस बिंदु पर पार होती है?
",ऑप्टिक तंत्रिका,ऑप्टिक चायस्मा,फोविया,पार्श्व जेनिकुलेट नाभिक,B,"['none', 'none', 'none', 'none']","['No', 'No', 'No', 'No']","['-', '-', '-', '-']",[],[],[],CA,True
high_school_statistics/test/15,high_school_statistics,STEM,"यदि अन्य सभी चर स्थिर रहें, तो निम्न में से कौन परिकल्पना परीक्षण की शक्ति को बढ़ाएगा? I. नमूना आकार बढ़ाना। II. महत्व स्तर बढ़ाना। III. टाइप II त्रुटि की संभावना बढ़ाना।",I केवल,केवल II,केवल III,I और II,D,"['none', 'none', 'none', 'none']","['No', 'No', 'No', 'No']","['-', '-', '-', '-']",[],[],[],CA,True
high_school_statistics/test/25,high_school_statistics,STEM,"बड़ी कंपनी के दो स्थानों पर कार्यालय हैं, एक न्यू जर्सी में और दूसरा यूटा में। न्यू जर्सी कार्यालय में कार्यालय सहायकों का औसत वेतन $28,500 है। यूटा कार्यालय में कार्यालय सहायकों का औसत वेतन $22,500 है। न्यू जर्सी कार्यालय में 128 कार्यालय सहायक हैं और यूटा कार्यालय में 32 कार्यालय सहायक हैं। इस कंपनी में कार्यालय सहायकों को दिया जाने वाला औसत वेतन क्या है?","$22,500","$23,700","$25,500","$27,300",D,"['regional', 'none', 'regional', 'none']","['No', 'No', 'No', 'No']","['-', '-', '-', '-', '-']",[],['North America'],"['United States of America (USA)', 'United States of America (USA)']",CS,True
high_school_statistics/test/33,high_school_statistics,STEM,"अटलांटा हवाई अड्डे पर एक छोटा कियोस्क $3.99 से $29.99 की कीमत वाला स्मृति चिन्ह बेचता है, जिसका औसत मूल्य $14.75 है। हवाई अड्डे के अधिकारियों ने कियोस्क के लिए लगाए जाने वाले किराए में 5 प्रतिशत की वृद्धि करने का फैसला किया। बढ़े हुए किराए की भरपाई के लिए, कियोस्क मालिक सभी वस्तुओं की कीमतों में 50 सेंट की वृद्धि करने का फैसला करता है। परिणामस्वरूप, निम्नलिखित में से क्या होगा?",औसत मूल्य और मूल्य सीमा में 50 सेंट की वृद्धि होगी।,"माध्य कीमत वही रहेगी, लेकिन कीमतों की सीमा 50 सेंट तक बढ़ जाएगी।",माध्य मूल्य और मूल्यों का मानक विचलन 50 सेंट बढ़ जाएगा।,"माध्य कीमत में 50 सेंट की वृद्धि होगी, लेकिन कीमतों का मानक विचलन वही रहेगा।",D,"['regional', 'none', 'regional', 'none', 'dialect', 'none']","['No', 'No', 'No', 'No', 'No', 'No']","['-', '-', '-', '-', '-', '-']",[],"['North America', 'North America', 'North America']","['United States of America (USA)', 'United States of America (USA)', 'United States of America (USA)']",CS,True
high_school_statistics/test/63,high_school_statistics,STEM,"एक किस्म के पचास संतरे बेतरतीब रूप से चुने गए और उनका वजन किया गया। इस किस्म के संतरे के औसत वजन का अनुमान लगाने के लिए नमूना वजन से गणना की गई 95 प्रतिशत विश्वास अंतराल (7.58, 8.72) औंस है। उपयोग किए गए विश्वास स्तर के संबंध में निम्नलिखित में से कौन सा कथन सत्य है?","एक ही आकार के बार-बार लिए गए नमूनों में, निर्मित अंतरालों में से 95 प्रतिशत में इस किस्म के संतरों का वास्तविक औसत वजन शामिल होगा।","एक ही आकार के बार-बार नमूने लेने पर, निर्मित अंतरालों में से 95 प्रतिशत में संतरों का नमूना औसत भार शामिल होगा।",इस नमूने में 95 प्रतिशत संतरों का वजन 7.58 से 8.72 औंस के बीच है।,इस किस्म के 95 प्रतिशत संतरों का वजन 7.58 से 8.72 औंस के बीच होता है।,A,"['none', 'regional', 'regional', 'none']","['No', 'No', 'No', 'No']","['-', '-', '-', '-']",[],[],[],CS,True
high_school_statistics/test/107,high_school_statistics,STEM,"कुत्तों में हार्टवर्म के लिए किए गए परीक्षण से 96% कुत्तों में सकारात्मक परिणाम दिखाई देता है जिनमें वास्तव में हार्टवर्म होता है, और 98% कुत्तों में नकारात्मक परिणाम दिखाई देता है जिनमें हार्टवर्म नहीं होता। यदि हार्टवर्म वास्तव में 10% कुत्तों में होता है, तो क्या संभावना है कि यादृच्छिक रूप से चुने गए कुत्ते में हार्टवर्म के लिए सकारात्मक परीक्षण वास्तव में हार्टवर्म है?",11%,18%,84%,88%,C,"['none', 'none', 'none', 'none', 'none', 'none', 'none']","['No', 'No', 'No', 'No', 'No', 'No', 'No']","['-', '-', '-', '-', '-', '-', '-']",[],[],[],CA,True
high_school_statistics/test/124,high_school_statistics,STEM,"सॉफ्ट ड्रिंक डिस्पेंसर को किसी भी निश्चित संख्या में औंस देने के लिए समायोजित किया जा सकता है। यदि मशीन 0.3 औंस के बराबर डिलीवरी में मानक विचलन के साथ काम कर रही है, तो औसत सेटिंग क्या होनी चाहिए ताकि 12 औंस का कप 1% से कम समय में ओवरफ्लो हो? वितरित औंस के लिए एक सामान्य वितरण मान लें।",12 - 0.99(0.3) औंस,12 - 2.326(0.3) औंस,12 - 2.576(0.3) औंस,12 + 2.326(0.3) औंस,B,"['regional', 'none', 'regional', 'none']","['No', 'No', 'No', 'No']","['-', '-', '-', '-']",[],[],"['United States of America (USA)', 'United States of America (USA)']",CS,True
high_school_statistics/test/158,high_school_statistics,STEM,"एक महानगरीय क्षेत्र में, तकनीकी लेखकों का वार्षिक वेतन लगभग सामान्य रूप से वितरित होता है, जिसका औसत $55,800 है। वेतन का पहला चतुर्थक $48,815 है। मानक विचलन क्या है?","$6,984","$10,356","$10,476","$13,968",B,"['none', 'none', 'regional', 'none']","['No', 'No', 'Yes', 'No']","['-', '-', '-', '-']",['Western Culture'],['North America'],['United States of America (USA)'],CA,True
high_school_statistics/test/191,high_school_statistics,STEM,"यदि किसी डेटा सेट के सभी मान समान हैं, तो निम्नलिखित में से किसे छोड़कर सभी शून्य के बराबर होंगे?",औसत,मानक विचलन,विचरण,श्रेणी,A,"['none', 'none', 'none', 'none']","['No', 'No', 'No', 'No']","['-', '-', '-', '-']",[],[],[],CA,True
