sample_id,subject,subject_category,question,option_a,option_b,option_c,option_d,answer,required_knowledge,time_sensitive,reference,culture,region,country,cultural_sensitivity_label,is_annotated,gpt4o-mini_rawtext,gpt4o-mini
professional_accounting/test/142,professional_accounting,Business,ভবিষ্যতে অন্য কোনও কাজে ব্যবহার হতে পারে; গবেষণা ও উন্নয়নের কাজে ব্যবহৃত এমন যন্ত্রপাতিগুলির ব্যয় দেখানোর উপযুক্ত পদ্ধতি নিচের কোনটি?,গবেষণা এবং উন্নয়ন প্রকল্প শুরু হওয়া বছরে খরচ দেখানো,গবেষণা এবং উন্নয়ন প্রকল্পের সময়কালে মূলধন হিসাবে এবং অবচয় হিসাবে দেখানো।,এর আনুমানিক কর্মকালে মূলধন এবং অবচয় হিসাবে দেখানো।,গবেষণা এবং উন্নয়ন প্রকল্পের সময়কালের উপর নির্ভর করে মূলধন হিসাবে অথবা ব্যয় হিসাবে দেখানো তবে কখনোই একসাথে নয়।,C,"['none', 'none', 'none', 'none', 'none']","['No', 'No', 'No', 'No', 'No']","['-', '-', '-', '-', '-']",[],[],[],CA,True,"প্রথমে, আমি গবেষণা ও উন্নয়নের কাজে ব্যবহৃত যন্ত্রপাতির ব্যয় দেখানোর বিভিন্ন পদ্ধতি বিশ্লেষণ করব। 

প্রথম পদ্ধতি (a) অনুযায়ী, খরচ শুধুমাত্র প্রকল্প শুরু হওয়া বছরে দেখানো হয়, যা প্রকল্পের পুরো সময়কালকে প্রতিফলিত করে না। 

দ্বিতীয় পদ্ধতি (b) অনুযায়ী, যন্ত্রপাতির ব্যয় প্রকল্পের সময়কালে মূলধন হিসাবে এবং অবচয় হিসাবে দেখানো হয়, যা একটি সঠিক পদ্ধতি কারণ এটি যন্ত্রপাতির ব্যবহার এবং তার অবমূল্যায়নকে প্রতিফলিত করে। 

তৃতীয় পদ্ধতি (c) অনুযায়ী, আনুমানিক কর্মকালের ভিত্তিতে মূলধন এবং অবচয় হিসাবে দেখানো হয়, যা কিছুটা সঠিক হলেও প্রকল্পের সময়কালকে পুরোপুরি প্রতিফলিত করে না। 

চতুর্থ পদ্ধতি (d) অনুযায়ী, ব্যয় এবং মূলধন হিসাবে দেখানো হয় তবে কখনোই একসাথে নয়, যা কিছুটা জটিল এবং বাস্তবায়নে সমস্যা সৃষ্টি করতে পারে। 

এখন, দ্বিতীয় পদ্ধতি (b) সবচেয়ে উপযুক্ত কারণ এটি প্রকল্পের সময়কাল এবং যন্ত্রপাতির অবমূল্যায়ন উভয়কেই সঠিকভাবে প্রতিফলিত করে। 

অতএব, সঠিক উত্তর হল {'sol': 'b'}।",b
professional_accounting/test/151,professional_accounting,Business,কোনও CPA-এর পক্ষে অজ্ঞতার অভিযোগের মামলায় নিম্নলিখিত কোন প্রতিরক্ষাটি সফল হতে পারে? ,যথাযথ যত্ন,আইন সম্পর্কে অজ্ঞতা,সংকল্পহীনতা,মানসিক সক্ষমতার অভাব,A,"['cultural', 'none', 'none', 'cultural']","['No', 'No', 'No', 'No']","['-', '-', '-', '-']",[],[],[],CS,True,"প্রথমে, আমি প্রতিটি বিকল্পের অর্থ এবং প্রাসঙ্গিকতা বিশ্লেষণ করব।

a) যথাযথ যত্ন: এটি একটি প্রতিরক্ষা যা দেখায় যে অভিযুক্ত ব্যক্তি তাদের কাজের ক্ষেত্রে যথাযথ যত্ন নিয়েছে এবং তাদের পেশাগত দায়িত্ব পালন করতে যথাসাধ্য চেষ্টা করেছে। এটি একটি শক্তিশালী প্রতিরক্ষা হতে পারে।

b) আইন সম্পর্কে অজ্ঞতা: সাধারণত, আইন সম্পর্কে অজ্ঞতা একটি প্রতিরক্ষা হিসাবে গ্রহণযোগ্য নয়। আইন জানার দায়িত্ব ব্যক্তির উপর থাকে, তাই এটি সফল হতে পারে না।

c) সংকল্পহীনতা: এটি মানসিক অবস্থার একটি দিক, তবে এটি সাধারণত অজ্ঞতার অভিযোগের ক্ষেত্রে প্রযোজ্য নয়। এটি একটি দুর্বল প্রতিরক্ষা।

d) মানসিক সক্ষমতার অভাব: এটি একটি প্রতিরক্ষা হতে পারে, তবে এটি সাধারণত অজ্ঞতার অভিযোগের ক্ষেত্রে প্রযোজ্য নয়। এটি অন্য ধরনের অপরাধের জন্য প্রযোজ্য হতে পারে।

এখন, আমি সিদ্ধান্তে আসি। ""যথাযথ যত্ন"" প্রতিরক্ষা হিসাবে সবচেয়ে কার্যকর হতে পারে, কারণ এটি দেখায় যে CPA তাদের পেশাগত দায়িত্ব পালন করতে যথাসাধ্য চেষ্টা করেছে।

অতএব, সঠিক উত্তর হল {'sol': 'a'}।",a
professional_accounting/test/156,professional_accounting,Business,নিম্নলিখিত কোন বিবৃতিটি সম্ভবত একজন নিরীক্ষকের নিযুক্তি বা চুক্তিপত্রে উপস্থিত থাকবে?,সম্পত্তির সুরক্ষার জন্য গৃহীত কোনও অনুপযুক্ত পদক্ষেপ জানানোর জন্য কর্তৃপক্ষ দায়ী থাকবে।,গুরুতর ত্রুটি আটকাতে বা শনাক্ত করতে পারে এমন নির্দিষ্ট দাবিগুলির সাথে প্রাসঙ্গিক অভ্যন্তরীণ নিয়ন্ত্রণগুলি আমরা চিহ্নিত করবো।,অভ্যন্তরীণ নিয়ন্ত্রণে আমাদের শনাক্ত করা ঘাটতিগুলির সংশোধন করতে কর্তৃপক্ষ সম্মত হয়েছে।,আমাদের কাছে সমস্ত আর্থিক নথিপত্র এবং সংশ্লিষ্ট তথ্য উপলব্ধ করার জন্য কর্তৃপক্ষ দায়ী।,D,"['none', 'none', 'none']","['No', 'No', 'No']","['-', '-', '-', '-']",[],[],[],CA,True,"প্রথমে, আমি প্রতিটি বিকল্পের বিষয়বস্তু বিশ্লেষণ করব এবং নিরীক্ষকের নিযুক্তি বা চুক্তিপত্রে কোনটি সাধারণত অন্তর্ভুক্ত হয় তা নির্ধারণ করব।

১. বিকল্প (a): ""সম্পত্তির সুরক্ষার জন্য গৃহীত কোনও অনুপযুক্ত পদক্ষেপ জানানোর জন্য কর্তৃপক্ষ দায়ী থাকবে।"" - এটি একটি সাধারণ বিবৃতি, তবে এটি নিরীক্ষকের চুক্তিপত্রে সাধারণত উল্লেখ করা হয় না।

২. বিকল্প (b): ""গুরুতর ত্রুটি আটকাতে বা শনাক্ত করতে পারে এমন নির্দিষ্ট দাবিগুলির সাথে প্রাসঙ্গিক অভ্যন্তরীণ নিয়ন্ত্রণগুলি আমরা চিহ্নিত করবো।"" - এটি একটি নিরীক্ষকের কাজের অংশ, তবে এটি চুক্তিপত্রে সাধারণত উল্লেখ করা হয় না।

৩. বিকল্প (c): ""অভ্যন্তরীণ নিয়ন্ত্রণে আমাদের শনাক্ত করা ঘাটতিগুলির সংশোধন করতে কর্তৃপক্ষ সম্মত হয়েছে।"" - এটি একটি গুরুত্বপূর্ণ দায়িত্ব এবং সাধারণত চুক্তিপত্রে অন্তর্ভুক্ত হয়।

৪. বিকল্প (d): ""আমাদের কাছে সমস্ত আর্থিক নথিপত্র এবং সংশ্লিষ্ট তথ্য উপলব্ধ করার জন্য কর্তৃপক্ষ দায়ী।"" - এটি একটি মৌলিক দায়িত্ব যা নিরীক্ষকের চুক্তিপত্রে সাধারণত উল্লেখ করা হয়।

এখন, আমি দেখতে পাচ্ছি যে বিকল্প (c) এবং (d) উভয়ই গুরুত্বপূর্ণ, তবে (d) হল একটি মৌলিক দায়িত্ব যা সাধারণত নিরীক্ষকের চুক্তিপত্রে অন্তর্ভুক্ত হয়। 

অতএব, সঠিক উত্তর হল {'sol': 'd'}।",d
professional_accounting/test/168,professional_accounting,Business,"যদি ছাড়ের হার 9% হয়, তাহলে $10-এর দুই বছরের মধ্যে প্রাপ্ত বর্তমান মূল্য কত হবে? ",$9,$11,$8.26,$8.42,D,"['none', 'none', 'none', 'none']","['No', 'No', 'No', 'No']","['-', '-', '-', '-']",[],[],['Türkiye'],CA,True,"প্রথমে, আমাকে বর্তমান মূল্য (PV) গণনা করার জন্য সূত্রটি ব্যবহার করতে হবে। বর্তমান মূল্য গণনা করার জন্য সূত্র হল:

\[ PV = \frac{FV}{(1 + r)^n} \]

এখানে,
- \( FV \) হল ভবিষ্যৎ মূল্য ($10),
- \( r \) হল ছাড়ের হার (9% বা 0.09),
- \( n \) হল সময়কাল (2 বছর)।

এখন, আমি সূত্রে মানগুলি প্রতিস্থাপন করব:

\[ PV = \frac{10}{(1 + 0.09)^2} \]

এখন, প্রথমে \( (1 + 0.09)^2 \) গণনা করি:

\[ (1 + 0.09)^2 = (1.09)^2 = 1.1881 \]

এখন, আমি বর্তমান মূল্য বের করতে পারি:

\[ PV = \frac{10}{1.1881} \approx 8.42 \]

অতএব, বর্তমান মূল্য $8.42। সঠিক উত্তর হল {'sol': 'd'}.",d
professional_accounting/test/175,professional_accounting,Business,নিম্নলিখিত কোন লেনদেনটি সঠিকভাবে উল্লেখযোগ্য কর্মক্ষমতার মতবাদকে ব্যাখ্যা করে?,ব্লেয়ার কাইলকে এক ডজন নীল চেয়ার দেওয়ার অর্ডার করেছিলেন কিন্তু কাইল একডজন লাল চেয়ার সরবরাহ করেছেন।,লেসলি একটি ঘরকে সম্পূর্ণ রঙ করেছেন কিন্তু বৈদ্যুতিক আউটলেট কভারগুলি পুনরায় লাগাতে পারেননি।,একটি চুক্তি অনুযায়ী টবির সন্তুষ্টিমত তার চুলের স্টাইল করে দেওয়ার কথা ছিল কিন্তু টবি ফলাফল নিয়ে ভীষণ অসন্তুষ্ট ছিলেন।,"একজন দাঁতের ডাক্তার সুদক্ষভাবে লি-এর দাঁত তুলেছিলেন, কিন্তু ভুলবশত তিনি অন্য দাঁত তুলে ফেলেছিলেন।",B,"['regional', 'none', 'none', 'regional']","['No', 'No', 'No', 'No']","['-', '-', '-', '-']",[],[],[],CS,True,"প্রথমে, উল্লেখযোগ্য কর্মক্ষমতার মতবাদ বোঝা দরকার। এটি একটি ধারণা যা বলে যে একটি লেনদেন বা কাজের ফলাফল কিভাবে প্রত্যাশিত বা চুক্তিবদ্ধ মানের সাথে মেলে। 

ধাপ 1: প্রতিটি বিকল্পের বিশ্লেষণ করা। 
- বিকল্প (a): ব্লেয়ার কাইলকে এক ডজন নীল চেয়ার দেওয়ার জন্য অর্ডার করেছিলেন, কিন্তু কাইল এক ডজন লাল চেয়ার সরবরাহ করেছেন। এখানে সরবরাহিত পণ্য প্রত্যাশিত পণ্যের সাথে মেলে না।
- বিকল্প (b): লেসলি একটি ঘরকে সম্পূর্ণ রঙ করেছেন কিন্তু বৈদ্যুতিক আউটলেট কভারগুলি পুনরায়",
professional_accounting/test/198,professional_accounting,Business,একটি সংস্থা তাদের আয়কর বেসিস অনুযায়ী আর্থিক বিবৃতি প্রস্তুত করে। আনুষঙ্গিক নোটসের মধ্যে রয়েছে গুরুত্বপূর্ণ হিসাবরক্ষার নীতি যেখানে উপস্থাপনার বেসিস নিয়ে আলোচনা করা আছে এবং যেটি বর্ণনা করে কীভাবে উক্ত বেসিসটি GAAP-এর থেকে পৃথক। আয়কর বেসিস এবং GAAP-এর মধ্যের পার্থক্যের প্রভাবের ডলার পরিমাণটির,শুধুমাত্র নিরীক্ষকের রিপোর্টে অন্তর্ভুক্ত করার প্রয়োজনীয়তা রয়েছে।,শুধুমাত্র আর্থিক বিবৃতির সাথে থাকা নোটগুলিতে অন্তর্ভুক্ত করার প্রয়োজনীয়তা রয়েছে।,"নিরীক্ষকের রিপোর্ট এবং আর্থিক বিবৃতির সাথে থাকা নোট, উভয়ের মধ্যেই অন্তর্ভুক্ত করার প্রয়োজনীয়তা রয়েছে।","পরিমাপ করার প্রয়োজন নেই নিরীক্ষকের রিপোর্ট এবং আর্থিক বিবৃতির সাথে থাকা নোট, কোনওটির মধ্যেই অন্তর্ভুক্ত করার প্রয়োজনীয়তা নেই।",D,"['regional', 'regional', 'regional', 'regional']","['No', 'No', 'No', 'No']","[{'end': 185, 'label': 'Geographic', 'score': None, 'start': 113}, {'end': 244, 'label': 'Geographic', 'score': None, 'start': 238}, '-', '-', '-']",[],['North America'],"['United States of America (USA)', 'United States of America (USA)']",CS,True,"প্রথমে, আমি আয়কর বেসিস এবং GAAP-এর মধ্যে পার্থক্য বুঝতে হবে। আয়কর বেসিস সাধারণত করের উদ্দেশ্যে ব্যবহৃত হয় এবং এটি GAAP-এর থেকে ভিন্ন হতে পারে, কারণ GAAP আর্থিক বিবৃতির জন্য একটি নির্দিষ্ট মানদণ্ড প্রদান করে।

দ্বিতীয়ত, যখন একটি সংস্থা তাদের আর্থিক বিবৃতি প্রস্তুত করে, তখন তাদের উচিত এই পার্থক্যগুলি সঠিকভাবে উপস্থাপন করা যাতে ব্যবহারকারীরা সঠিক তথ্য পেতে পারে। এটি সাধারণত আর্থিক বিবৃতির নোটগুলিতে অন্তর্ভুক্ত করা হয়।

তৃতীয়ত, নিরীক্ষকের রিপোর্টে এই পার্থক্যগুলি উল্লেখ করা গুরুত্বপূর্ণ, কারণ এটি নিরীক্ষকের দৃষ্টিকোণ থেকে আর্থিক বিবৃতির সঠিকতা এবং সম্পূর্ণতা নিশ্চিত করে।

এখন, উক্ত তথ্যের ভিত্তিতে, আমি সিদ্ধান্তে আসি যে আয়কর বেসিস এবং GAAP-এর মধ্যে পার্থক্যের প্রভাবের ডলার পরিমাণটি উভয় ক্ষেত্রেই অন্তর্ভুক্ত করা উচিত, অর্থাৎ নিরীক্ষকের রিপোর্ট এবং আর্থিক বিবৃতির নোট উভয়েই।

অতএব, সঠিক উত্তর হল {'sol': 'c'}।",c
professional_accounting/test/216,professional_accounting,Business,ডাক্ট একটি নতুন পণ্য যার জন্য 20% অবদান সীমার লক্ষ্য ঠিক করা হয়েছে। এই পণ্যটির একক ব্যয় নিম্নলিখিত: উৎপাদন খরচ পরিবর্তনশীল $12 স্থায়ী 8 বিক্রয় এবং পরিচালনাসংক্রান্ত খরচ $3 স্থায়ী 5। ডাক্ট-এর বিক্রয় মূল্য কত হবে? ,$18.00,$18.75,$25.00,33.6,B,"['none', 'none', 'regional', 'none', 'none']","['No', 'No', 'No', 'No', 'No']","['-', '-', '-', '-', '-']",[],['North America'],['United States of America (USA)'],CA,True,"প্রথমে, আমাকে পণ্যের মোট খরচ নির্ধারণ করতে হবে। উৎপাদন খরচের পরিবর্তনশীল অংশ $12 এবং স্থায়ী অংশ $8, তাই মোট উৎপাদন খরচ হবে:

মোট উৎপাদন খরচ = পরিবর্তনশীল খরচ + স্থায়ী খরচ = $12 + $8 = $20।

এখন, বিক্রয় এবং পরিচালনাসংক্রান্ত খরচের জন্য, পরিবর্তনশীল খরচ $3 এবং স্থায়ী খরচ $5, তাই মোট বিক্রয় এবং পরিচালনাসংক্রান্ত খরচ হবে:

মোট বিক্রয় এবং পরিচালনাসংক্রান্ত খরচ = পরিবর্তনশীল খরচ + স্থায়ী খরচ = $3 + $5 = $8।

এখন, মোট খরচ হবে:

মোট খরচ = মোট উৎপাদন খরচ + মোট বিক্রয় এবং পরিচালনাসংক্রান্ত খরচ = $20 + $8 = $28।

ডাক্ট একটি নতুন পণ্যের জন্য 20% অবদান সীমার লক্ষ্য ঠিক করেছে। এর মানে হল, বিক্রয় মূল্য (SP) এর 20% হবে মোট খরচের 100%। 

অতএব, আমরা নিম্নলিখিত সমীকরণটি ব্যবহার করতে পারিঃ

SP = মোট খরচ / (1 - অবদান সীমা) = $28 / (1 - 0.20) = $28 / 0.80 = $35।

তবে, বিক্রয় মূল্য $35 নয়, কারণ আমাদের বিক্রয় মূল্য নির্ধারণের জন্য অবদান সীমার 20% হিসাব করতে হবে। 

অতএব, বিক্রয় মূল্য হবে:

SP = মোট খরচ + অবদান = $28 + (20% * $28) = $28 + $5.6 = $33.6।

অতএব, সঠিক উত্তর হল {'sol': 'd'}।",d
