sample_id,subject,subject_category,question,option_a,option_b,option_c,option_d,answer,required_knowledge,time_sensitive,reference,culture,region,country,cultural_sensitivity_label,is_annotated,gpt4o-mini_rawtext,gpt4o-mini
logical_fallacies/test/68,logical_fallacies,Humanities,"আপনি যদি মনে করেন যে কারও যুক্তি তাদের বাধ্যতামূলক ভাষার ব্যবহার এবং আত্মবিশ্বাসের সাথে বলার উপর ভিত্তি করে সুদৃঢ় হয়, তাহলে আপনি সম্ভবত কোন কুযুক্তি নিয়ে থাকেন?",ব্যাকরণের কারণে অস্পষ্টতা (অ্যামফিবোলি),একই শব্দের ভিন্ন ব্যবহার (Equivocation),বিশেষ আবেদন (Special pleading),যৌক্তিক বিশ্লেষণের পরিবর্তে শৈলীর কুযুক্তিকে (style over substance fallacy),D,"['cultural', 'none', 'none', 'none']","['No', 'No', 'No', 'No']","['-', '-', '-', '-']",['Western Culture'],[],[],CA,True,"প্রথমে, আমি প্রশ্নের মূল বক্তব্য বুঝতে চেষ্টা করব। এখানে বলা হচ্ছে যে, কেউ যদি তাদের যুক্তি শক্তিশালী মনে করে শুধুমাত্র ভাষার ব্যবহার এবং আত্মবিশ্বাসের উপর ভিত্তি করে, তাহলে এটি একটি কুযুক্তি হতে পারে।

দ্বিতীয়ত, আমি বিকল্পগুলির মধ্যে বিশ্লেষণ করব:
a) ব্যাকরণের কারণে অস্পষ্টতা (অ্যামফিবোলি) - এটি তখন ঘটে যখন বাক্যের গঠন অস্পষ্ট হয়, কিন্তু এখানে আত্মবিশ্বাসের উপর ভিত্তি করে যুক্তি দেওয়া হচ্ছে।
b) একই শব্দের ভিন্ন ব্যবহার (Equivocation) - এটি তখন ঘটে যখন একটি শব্দের একাধিক অর্থ ব্যবহার করা হয়, কিন্তু এখানে এটি প্রযোজ্য নয়।
c) বিশেষ আবেদন (Special pleading) - এটি তখন ঘটে যখন একজন ব্যক্তি তাদের যুক্তির জন্য বিশেষ শর্ত তৈরি করে, কিন্তু এটি এখানে প্রযোজ্য নয়।
d) যৌক্তিক বিশ্লেষণের পরিবর্তে শৈলীর কুযুক্তিকে (style over substance fallacy) - এটি তখন ঘটে যখন যুক্তির শৈলীকে গুরুত্ব দেওয়া হয়, কিন্তু যুক্তির মূল বিষয়কে উপেক্ষা করা হয়।

তৃতীয়ত, আমি দেখতে পাচ্ছি যে প্রশ্নের মধ্যে যে ধারণাটি রয়েছে, তা হল যুক্তির শৈলী এবং আত্মবিশ্বাসের উপর ভিত্তি করে যুক্তির শক্তি নির্ধারণ করা। তাই সঠিক উত্তর হবে 'd'।

অতএব, সঠিক উত্তর হল {'sol': 'd'}.",d
logical_fallacies/test/90,logical_fallacies,Humanities,"আপনি যদি যুক্তি দিয়ে থাকেন যে কোনোকিছু ত্রুটিপূর্ণ কারণ এটি এমন কিছু করতে ব্যর্থ হয়, যেক্ষেত্রে এটির কখনো তা করার কথা ছিল না, তাহলে আপনি নীচের কোনটি কুযুক্তি দিয়েচ্যহে?",অজ্ঞতার যুক্তি (ad ignorantium),অনেক প্রশ্ন (Many questions),সম্প্রসারণ (Extension),যৌগিক বিবৃতি (Compound proposition),C,"['none', 'cultural', 'cultural', 'none']","['No', 'No', 'No', 'No']","['-', '-', '-', '-']","['Western Culture', 'Western Culture']",[],[],CS,True,"প্রথমে, প্রশ্নটি বুঝতে হবে। এখানে বলা হচ্ছে যে, যদি কেউ যুক্তি দেয় যে কিছু ত্রুটিপূর্ণ কারণ এটি এমন কিছু করতে ব্যর্থ হয়েছে, যা করার কথা ছিল না, তাহলে এটি একটি কুযুক্তি। 

দ্বিতীয়ত, এই যুক্তিটি মূলত একটি অজ্ঞতার যুক্তি (ad ignorantium) এর উদাহরণ। কারণ, এটি একটি ধারণা তৈরি করছে যে কিছু ত্রুটিপূর্ণ, শুধুমাত্র এই কারণে যে এটি কিছু করতে ব্যর্থ হয়েছে, যা আসলে তার উদ্দেশ্য ছিল না।

তৃতীয়ত, অন্যান্য অপশনগুলো বিশ্লেষণ করলে দেখা যায়:
- ""অনেক প্রশ্ন"" (Many questions) সাধারণত একটি যুক্তির মধ্যে বিভ্রান্তি তৈরি করে।
- ""সম্প্রসারণ"" (Extension) একটি যুক্তির প্রসারিত করার প্রক্রিয়া।
- ""যৌগিক বিবৃতি"" (Compound proposition) একাধিক বিবৃতির সমন্বয়।

অতএব, সঠিক উত্তর হবে {'sol': 'a'}।",a
logical_fallacies/test/130,logical_fallacies,Humanities,"নীচের কোন কুযুক্তি ঘটবে যদি কেউ যুক্তি দেয় যে আপনি একজন যুক্তিসঙ্গত এবং মেধাবী ব্যক্তি, তাহলে আপনি অবশ্যই বুঝতে পারবেন যে তার দাবিটি সত্য?",তাৎপর্য (significance),প্রাধিকারের কুযুক্তি (argument from authority),গর্বের প্রতি আবেদন (appeal to pride),অনাকাঙ্ক্ষিত পরিণতির দিকে নিয়ে যাওয়া ঘটনা পরম্পরা (Slippery Slope),C,"['none', 'cultural', 'cultural', 'none']","['No', 'No', 'No', 'No']","['-', '-', '-', '-']","['Western Culture', 'Western Culture']",[],[],CS,True,"প্রথমে, আমি প্রশ্নের মূল বক্তব্যটি বিশ্লেষণ করব। এখানে বলা হচ্ছে যে, যদি কেউ দাবি করে যে আপনি যুক্তিসঙ্গত এবং মেধাবী, তাহলে আপনি অবশ্যই বুঝতে পারবেন যে তার দাবিটি সত্য। 

দ্বিতীয়ত, এই যুক্তিটি একটি বিশেষ ধরনের কুযুক্তি নির্দেশ করে যেখানে একজন ব্যক্তি তার মেধা বা যুক্তিসঙ্গততা দ্বারা অন্যের দাবিকে সমর্থন করার চেষ্টা করছে। এটি প্রাধিকারের কুযুক্তির একটি উদাহরণ, যেখানে একজন ব্যক্তির অবস্থান বা ক্ষমতা তার দাবির সত্যতা প্রমাণের জন্য ব্যবহার করা হচ্ছে।

তৃতীয়ত, আমি বিকল্পগুলির মধ্যে সঠিক উত্তরটি চিহ্নিত করব। এখানে ""প্রাধিকারের কুযুক্তি"" (argument from authority) সবচেয়ে উপযুক্ত কারণ এটি একটি যুক্তি যেখানে একজন বিশেষজ্ঞ বা কর্তৃপক্ষের মতামতকে সত্য হিসেবে গ্রহণ করা হয়।

অতএব, সঠিক উত্তর হল {'sol': 'b'}।",b
logical_fallacies/test/134,logical_fallacies,Humanities,নীচের কোনটি ব্যাকরণের কারণে অস্পষ্টতা (amphiboly) কুযুক্তির অপর নাম?,অস্পষ্টতার অপব্যবহার (Misusing ambiguity),বিমূর্ততে বাস্তবে পরিবর্তন করা (Reification),ভাষালঙ্কার (Figure of speech),বিশেষ আবেদন (Special pleading),A,"['none', 'cultural', 'none', 'none']","['No', 'No', 'No', 'No']","['-', '-', '-', '-']",['Western Culture'],[],[],CA,True,"প্রথমে, আমাকে প্রশ্নের মূল বিষয়টি বুঝতে হবে। এখানে ""অস্পষ্টতা (amphiboly)"" একটি ব্যাকরণগত সমস্যা যা বাক্যের গঠন বা ভাষার কারণে অস্পষ্টতা সৃষ্টি করে।

দ্বিতীয়ত, আমি প্রতিটি বিকল্পের অর্থ বিশ্লেষণ করব:
a) অস্পষ্টতার অপব্যবহার (Misusing ambiguity) - এটি অস্পষ্টতার সাথে সম্পর্কিত, তবে এটি সরাসরি অস্পষ্টতার কুযুক্তির অপর নাম নয়।
b) বিমূর্ততে বাস্তবে পরিবর্তন করা (Reification) - এটি একটি ভিন্ন ধরনের যুক্তি, যা অস্পষ্টতার সাথে সম্পর্কিত নয়।
c) ভাষালঙ্কার (Figure of speech) - এটি ভাষার শৈলী বা অলঙ্কার, যা অস্পষ্টতার সাথে সম্পর্কিত নয়।
d) বিশেষ আবেদন (Special pleading) - এটি একটি যুক্তির প্রকার, যা অস্পষ্টতার সাথে সম্পর্কিত নয়।

তৃতীয়ত, আমি বুঝতে পারি যে ""অস্পষ্টতার অপব্যবহার"" শব্দটি অস্পষ্টতার সাথে সম্পর্কিত, তবে এটি কুযুক্তির অপর নাম নয়। অন্য বিকল্পগুলির মধ্যে, ""অস্পষ্টতা"" এর সাথে সবচেয়ে বেশি সম্পর্কিত কিছু নেই।

অতএব, সঠিক উত্তর হল {'sol': 'a'}।",a
logical_fallacies/test/138,logical_fallacies,Humanities,"আমাদের ঈশ্বর আছে বিশ্বাস করার সম্পূর্ণ অধিকার আছে। সব থেকে বড় কথা, নাস্তিকদের অন্যকিছু প্রমাণ করার সকল প্রচেষ্টা ব্যর্থ হয়েছে।",কর্তৃত্বের প্রতি আবেদন (appeal to authority),পূর্বগামিতাকে অস্বীকার করা (Denying the Antecedent),ব্যক্তির চরিত্র বিশ্লেষণ (ad hominem),অজ্ঞতা থেকে যুক্তি দেওয়া (Argument from Ignorance),D,"['none', 'cultural', 'cultural', 'none']","['No', 'No', 'No', 'No']","['-', '-', '-', '-']","['Western Culture', 'Western Culture']",[],[],CS,True,"প্রথমে, আমি প্রশ্নের মূল বক্তব্যটি বিশ্লেষণ করব। এখানে বলা হচ্ছে যে ঈশ্বরের অস্তিত্বে বিশ্বাস করার অধিকার আছে এবং নাস্তিকদের প্রমাণের প্রচেষ্টা ব্যর্থ হয়েছে। 

দ্বিতীয়ত, আমি দেখব যে এই বক্তব্যটি কোন ধরনের যুক্তির উপর ভিত্তি করে। এটি মূলত নাস্তিকদের যুক্তি বা প্রমাণের অভাবকে তুলে ধরে এবং ঈশ্বরের অস্তিত্বের পক্ষে একটি যুক্তি হিসেবে কাজ করে।

তৃতীয়ত, আমি বিকল্পগুলোর মধ্যে তুলনা করব। ""অজ্ঞতা থেকে যুক্তি দেওয়া"" (Argument from Ignorance) হল একটি যুক্তি যেখানে বলা হয় যে যদি কিছু প্রমাণিত না হয়, তাহলে সেটি মিথ্যা। এখানে ঈশ্বরের অস্তিত্বের বিরুদ্ধে নাস্তিকদের প্রমাণের অভাবকে তুলে ধরা হচ্ছে, যা এই ধরনের যুক্তির সাথে মিলে যায়।

অতএব, সঠিক উত্তর হল {'sol': 'd'}।",d
logical_fallacies/test/156,logical_fallacies,Humanities,"যদি কেউ বলে যে আপনি যদি কিছু করেন তাহলে তা চরম পরিণতির দিকে ঠেলে দেবে, কিন্তু আপনার কাজ এবং সেই পরিণতির মধ্যে কোনো কার্যকারণ সম্পর্কিত প্রমাণ আপনাকে প্রদান করে না, তাহলে সেই ব্যক্তি সম্ভবত নীচের কোন কুযুক্তি দিয়েছে?",কথার পুনরাবৃত্তি (ad nauseam),স্বতঃপ্রমাণিত সত্য (self evident truths),অনাকাঙ্ক্ষিত পরিণতির দিকে নিয়ে যাওয়া ঘটনা পরম্পরা (Slippery Slope),চাপা দেওয়া প্রমাণ (suppressed evidence),C,"['cultural', 'cultural', 'none', 'cultural']","['No', 'No', 'No', 'No']","['-', '-', '-', '-']","['Western Culture', 'Western Culture', 'Western Culture']",[],[],CS,True,"প্রথমে, প্রশ্নে উল্লেখিত পরিস্থিতি বিশ্লেষণ করতে হবে। এখানে বলা হচ্ছে যে, কেউ একটি কাজ করার জন্য আপনাকে সতর্ক করছে যে এটি চরম পরিণতির দিকে ঠেলে দেবে, কিন্তু তাদের বক্তব্যে কার্যকারণ সম্পর্কিত কোনো প্রমাণ নেই। 

দ্বিতীয়ত, ""চরম পরিণতির দিকে ঠেলে দেওয়া"" বলতে বোঝানো হচ্ছে যে, একটি নির্দিষ্ট কাজের ফলে একটি অতি নেতিবাচক ফলাফল ঘটবে, যা সাধারণত একটি কুযুক্তির উদাহরণ। 

তৃতীয়ত, ""Slippery Slope"" কুযুক্তি এমন একটি যুক্তি যেখানে বলা হয় যে, একটি নির্দিষ্ট পদক্ষেপ নেওয়া হলে তা অবশ্যম্ভাবীভাবে আরও খারাপ পরিণতির দিকে নিয়ে যাবে, যদিও এর মধ্যে কার্যকরী প্রমাণ নেই। 

এখন, এই বিশ্লেষণের ভিত্তিতে, সঠিক উত্তর হবে: {'sol': 'c'}।",c
management/test/5,management,Business,একটি গ্যান্ট চার্ট কিসের একটি ধরন?,কাজের প্রবাহের নকশা,কাজের সময়সূচীর নকশা,কাজের হারের নকশা,কাজের উৎপাদনগত নকশা,B,"['none', 'none', 'none', 'none', 'none']","['No', 'No', 'No', 'No', 'No']","['-', '-', '-', '-', '-']",[],[],[],CA,True,"প্রথমে, গ্যান্ট চার্টের উদ্দেশ্য এবং কার্যকারিতা বুঝতে হবে। গ্যান্ট চার্ট একটি ভিজ্যুয়াল টুল যা প্রকল্প ব্যবস্থাপনায় ব্যবহৃত হয় এবং এটি কাজের সময়সূচী এবং সময়সীমা প্রদর্শন করে।

দ্বিতীয়ত, গ্যান্ট চার্ট সাধারণত বিভিন্ন কাজের জন্য সময়সীমা এবং তাদের অগ্রগতির চিত্রায়ণ করে, যা প্রকল্পের সময়সূচী তৈরি করতে সহায়ক।

তৃতীয়ত, গ্যান্ট চার্টের মূল ফোকাস হল কাজের সময়সূচী এবং কাজের অগ্রগতি, তাই এটি কাজের সময়সূচীর নকশার একটি ধরন।

অতএব, সঠিক উত্তর হল {'sol': 'b'}।",b
management/test/6,management,Business,নিচের মধ্যে কোনটি ম্যাকগ্রেগরের থিওরি X-এর বৈশিষ্ট্য?,কর্মীরা দায়িত্বকে উপভোগ করেন।,কর্মীরা শারীরিক ও মানসিক প্রচেষ্টাকে কাজের স্বাভাবিক অংশ হিসেবে দেখেন।,কর্মীরা উদ্যোগ প্রদর্শন করতে পছন্দ করেন।,কর্মীরা পরিচালিত হতে পছন্দ করে।,D,"['regional', 'none', 'cultural', 'none']","['No', 'No', 'No', 'No']","['-', '-', '-', '-']","['Western Culture', 'Western Culture']",[],['United States of America (USA)'],CS,True,"প্রথমে, আমি ম্যাকগ্রেগরের থিওরি X এবং থিওরি Y-এর মূল ধারণাগুলি বুঝতে হবে। থিওরি X অনুযায়ী, কর্মীরা সাধারণত কাজ করতে অনিচ্ছুক এবং তাদেরকে পরিচালনা করতে হয়। 

দ্বিতীয়ত, আমি প্রতিটি বিকল্পের বিশ্লেষণ করব:
a) কর্মীরা দায়িত্বকে উপভোগ করেন। - এটি থিওরি Y-এর বৈশিষ্ট্য।
b) কর্মীরা শারীরিক ও মানসিক প্রচেষ্টাকে কাজের স্বাভাবিক অংশ হিসেবে দেখেন। - এটি থিওরি Y-এর বৈশিষ্ট্য।
c) কর্মীরা উদ্যোগ প্রদর্শন করতে পছন্দ করেন। - এটি থিওরি Y-এর বৈশিষ্ট্য।
d) কর্মীরা পরিচালিত হতে পছন্দ করে। - এটি থিওরি X-এর বৈশিষ্ট্য।

তৃতীয়ত, আমি সঠিক উত্তরটি চিহ্নিত করব। থিওরি X-এর বৈশিষ্ট্য হল যে কর্মীরা পরিচালিত হতে পছন্দ করে।

অতএব, সঠিক উত্তর হল {'sol': 'd'}.",d
management/test/7,management,Business,একটি প্রতিষ্ঠানের অবস্থা বা অবস্থান থেকে চালিত ক্ষমতা শব্দটির অর্থ কী?,রেফারেন্ট,বিশেষজ্ঞ,পুরস্কার,ন্যায়সঙ্গত,D,"['dialect', 'cultural', 'none', 'none']","['No', 'No', 'No', 'No']","['-', '-', '-', '-']",[],[],[],CS,True,"প্রথমে, আমাকে শব্দটির অর্থ বুঝতে হবে। ""চালিত ক্ষমতা"" শব্দটি সাধারণত একটি প্রতিষ্ঠানের ক্ষমতা",
management/test/9,management,Business,নিচের মধ্যে কে শিল্পক্ষেত্রে লোকহিতৈষী?,ফ্রেডরিক টেলর,সীবহম রনট্রী,হেনরি ফোর্ড,ম্যাক্স ওয়েবার,B,"['regional', 'none', 'cultural', 'none']","['No', 'No', 'No', 'No']","['-', '-', '-', '-']",['Western Culture'],['North America'],['United Kingdom (UK)'],CS,True,"প্রথমে, আমি শিল্পক্ষেত্রে লোকহিতৈষী ব্যক্তিদের চিনতে হবে। লোকহিতৈষী বলতে বোঝায় যারা সমাজের কল্যাণের জন্য কাজ করেন এবং তাদের কাজের মাধ্যমে মানুষের জীবনযাত্রার মান উন্নত করতে চান।

দ্বিতীয়ত, আমি প্রতিটি বিকল্পের অবদান এবং দর্শন বিশ্লেষণ করব:
a) ফ্রেডরিক টেলর - তিনি বৈজ্ঞানিক ব্যবস্থাপনার জনক এবং উৎপাদনশীলতা বৃদ্ধির জন্য পরিচিত, তবে তার কাজের মূল লক্ষ্য ছিল লাভ এবং দক্ষতা।
b) সীবহম রনট্রী - তিনি সমাজের উন্নয়নে কাজ করেছেন এবং লোকহিতৈষী প্রকল্পগুলিতে জড়িত ছিলেন।
c) হেনরি ফোর্ড - তিনি গাড়ি উৎপাদনে বিপ্লব ঘটিয়েছিলেন এবং শ্রমিকদের জন্য ভালো মজুরি ও কাজের পরিবেশের জন্য পরিচিত, তবে তার মূল লক্ষ্য ছিল ব্যবসায়িক লাভ।
d) ম্যাক্স ওয়েবার - তিনি সমাজবিজ্ঞানী এবং প্রশাসনিক তত্ত্বের জন্য পরিচিত, তবে তার কাজের মূল লক্ষ্য লোকহিতৈষী নয়।

তৃতীয়ত, সঠিক উত্তরটি চিহ্নিত করতে হবে। সীবহম রনট্রী শিল্পক্ষেত্রে লোকহিতৈষী হিসেবে পরিচিত।

অতএব, সঠিক উত্তর হল {'sol': 'b'}।",b
