sample_id,subject,subject_category,question,option_a,option_b,option_c,option_d,answer,required_knowledge,time_sensitive,reference,culture,region,country,cultural_sensitivity_label,is_annotated,gpt4o-mini_rawtext,gpt4o-mini
high_school_psychology/test/238,high_school_psychology,Social Sciences,নিচের কোনটি ইভান পাভলভের আকস্মিক আবিষ্কারকে সেরা বলে?,"ইঁদুরের সাথে পরীক্ষা করার সময়, পাভলভ আবিষ্কার করেছিলেন যে তিনি যদি বারবার একটি ""টি-ধাঁধাঁধাঁর"" এর একপাশে খাবারের গুলি রাখেন তবে ইঁদুরগুলি স্বয়ংক্রিয়ভাবে গোলকধাঁধাটির সেই পাশে ছুটে যাবে।","কুকুরের সাথে পরীক্ষা করার সময়, পাভলভ আবিষ্কার করেছিলেন যে একবার তার কুকুররা খাবারের সময় খাবার নিয়ে আসা পরিচারককে দেখতে এবং শুনতে অভ্যস্ত হয়ে পড়েছিল, তারা পরিচর্যাকারীর দৃষ্টি এবং শব্দের প্রতিক্রিয়ায় লালা নিঃসরণ করবে।","বিড়ালদের নিয়ে পরীক্ষা করার সময়, পাভলভ আবিষ্কার করেছিলেন যে তিনি যদি একটি ক্ষুধার্ত বিড়ালকে একটি বাক্সের ভিতরে রাখেন এবং বাক্সের বাইরে খাবার রাখেন তবে বিড়ালটি বাক্সের দরজা খুলতে একটি লিভার টিপতে ""শিখতে"" পারে।","পায়রা নিয়ে পরীক্ষা-নিরীক্ষা করার সময়, পাভলভ আবিষ্কার করেছিলেন যে তিনি যদি একটি পায়রাকে একটি বাক্সে রাখেন, তবে তিনি এটিকে চিনতে শর্ত দিতে পারেন যে যদি এটি একটি নির্দিষ্ট চাবিতে ঠেলাঠেলি করে তবে এটি একটি খাবারের খোসা পাবে।",B,"['cultural', 'cultural', 'none', 'none', 'regional', 'none']","['No', 'No', 'No', 'No', 'No', 'No']","['-', '-', '-', '-', '-', '-', '-']",['Other'],['Europe'],['Russian Federation'],CS,True,"প্রথমে, আমি প্রতিটি বিকল্পের বিষয়বস্তু বিশ্লেষণ করব এবং ইভান পাভলভের সবচেয়ে বিখ্যাত আবিষ্কারটি চিহ্নিত করার চেষ্টা করব।

১. বিকল্প (a) ইঁদুরের সাথে পরীক্ষা করার সময় পাভলভের আবিষ্কার সম্পর্কে কথা বলছে, কিন্তু এটি পাভলভের শর্তাধীন প্রতিক্রিয়া তত্ত্বের মূল ধারণার সাথে সম্পর্কিত নয়।

২. বিকল্প (b) কুকুরের সাথে পাভলভের পরীক্ষার কথা বলছে, যেখানে কুকুর খাবারের জন্য পরিচারককে দেখার পর লালা নিঃসরণ করে। এটি পাভলভের শর্তাধীন প্রতিক্রিয়া তত্ত্বের একটি ক্লাসিক উদাহরণ এবং এটি তার সবচেয়ে বিখ্যাত আবিষ্কার।

৩. বিকল্প (c) বিড়ালদের নিয়ে পরীক্ষা করার কথা বলছে, যা পাভলভের কাজের সাথে সম্পর্কিত নয় এবং এটি শর্তাধীন প্রতিক্রিয়া তত্ত্বের মূল ধারণা নয়।

৪. বিকল্প (d) পায়রা নিয়ে পরীক্ষা করার কথা বলছে, যা পাভলভের কাজের একটি অংশ হলেও এটি তার সবচেয়ে বিখ্যাত আবিষ্কার নয়।

এখন, আমি দেখতে পাচ্ছি যে বিকল্প (b) কুকুরের সাথে পাভলভের পরীক্ষার কথা বলছে, যা তার শর্তাধীন প্রতিক্রিয়া তত্ত্বের মূল উদাহরণ এবং এটি পাভলভের সবচেয়ে বিখ্যাত আবিষ্কার।

অতএব, সঠিক উত্তর হল {'sol': 'b'}।",b
high_school_psychology/test/281,high_school_psychology,Social Sciences,"একটি কার্টুনে, একজন দেবদূত এক কাঁধে বসে আছে এবং একজন শয়তান একটি চরিত্রের অন্য কাঁধে বসে আছে যাকে সিদ্ধান্ত নিতে হবে যে একজন গৃহহীন মানুষকে টাকা দিতে হবে কি না। শয়তান বলে, ""ওকে কিছু দিও না, তুমি তার চেয়ে ভালো টাকা ব্যবহার করবে।"" ফেরেশতা বলে, ""তাকে টাকা দাও কারণ তোমার চেয়ে তার বেশি প্রয়োজন।"" চরিত্রটি গৃহহীন মানুষকে তার অর্থের অর্ধেক দেয়। ফ্রেয়ডের ব্যাখ্যায়, প্রতিনিধিত্ব করে",লিবিডো,id,ইগো,সুপারইগো,D,"['cultural', 'none', 'cultural', 'none']","['No', 'No', 'No', 'No']","['-', '-', '-', '-']","['Western Culture', 'Western Culture']",[],[],CS,True,"প্রথমে, আমি ফ্রয়েডের তত্ত্বের মূল উপাদানগুলি বুঝতে হবে। ফ্রয়েডের মতে, মানুষের মন তিনটি প্রধান অংশে বিভক্ত: id, ego, এবং superego। 

1. **id**: এটি মৌলিক প্রবৃত্তি এবং ইচ্ছার প্রতিনিধিত্ব করে, যা আনন্দের জন্য তাড়না করে। এটি শয়তানের চরিত্রের মতো, যা স্বার্থপর এবং ক্ষণিকের আনন্দের দিকে মনোনিবেশ করে।
  
2. **ego**: এটি বাস্তবতার সাথে সম্পর্কিত এবং id এবং superego এর মধ্যে একটি ভারসাম্য বজায় রাখার চেষ্টা করে। এটি যুক্তি এবং বাস্তবতার ভিত্তিতে সিদ্ধান্ত নেয়।

3. **superego**: এটি নৈতিকতা এবং সামাজিক নিয়মের প্রতিনিধিত্ব করে, যা ফেরেশতার চরিত্রের মতো, যা সঠিক এবং ভুলের মধ্যে পার্থক্য করে এবং অন্যদের প্রতি সহানুভূতি দেখায়।

এখন, চরিত্রটি যখন গৃহহীন মানুষকে অর্থের অর্ধেক দেয়, তখন সে তার superego (ফেরেশতা) এর নির্দেশনা অনুসরণ করছে, যা তাকে অন্যের প্রয়োজনের প্রতি সহানুভূতি দেখাতে বলছে। 

অতএব, সঠিক উত্তর হবে {'sol': 'd'}।",d
high_school_psychology/test/309,high_school_psychology,Social Sciences,পর্যায়ক্রমে বিকাশ ঘটে কিনা তার উপর ফোকাস করা একজন মনোবিজ্ঞানী নিম্নলিখিত কোন বিতর্কে সবচেয়ে বেশি আগ্রহী?,প্রকৃতি বনাম শিক্ষাদান,ধারাবাহিকতা বনাম বিরতি,স্থিতিশীলতা বনাম পরিবর্তন,সাবজেক্টিভিটি বনাম বস্তুনিষ্ঠতা,A,"['none', 'none', 'none', 'none']","['No', 'No', 'No', 'No']","['-', '-', '-', '-']",[],[],[],CA,True,"প্রথমে, প্রশ্নটি বুঝতে হবে। এখানে একজন মনোবিজ্ঞানী পর্যায়ক্রমে বিকাশের উপর ফোকাস করছেন, যা বিকাশের ধারাবাহিকতা এবং বিরতি নিয়ে আলোচনা করে।

দ্বিতীয়ত, বিকাশের ধারাবাহিকতা বনাম বিরতি বিতর্কটি বোঝা গুরুত্বপূর্ণ। ধারাবাহিকতা বলতে বোঝায় যে বিকাশ একটি মসৃণ এবং ধারাবাহিক প্রক্রিয়া, যেখানে বিরতি বোঝায় যে বিকাশ বিভিন্ন পর্যায়ে ঘটে এবং মাঝে মাঝে বড় পরিবর্তন ঘটে।

তৃতীয়ত, বিকাশের এই দুই দিকের মধ্যে মনোবিজ্ঞানীর আগ্রহের কারণে, তিনি সম্ভবত এই বিতর্কের মধ্যে সবচেয়ে বেশি আগ্রহী। 

অতএব, সঠিক উত্তর হল {'sol': 'b'}।",b
high_school_psychology/test/314,high_school_psychology,Social Sciences,"প্রভাব আইন অনুযায়ী, নেতিবাচক পরিণতি দ্বারা অনুসরণ আচরণ",আরো ঘন ঘন ঘটবে,কম ঘন ঘন ঘটবে,আর কখনও সঞ্চালিত হবে না,আরো জোরপূর্বক সঞ্চালিত হবে,B,"['cultural', 'none', 'cultural', 'regional']","['No', 'No', 'No', 'No']","['-', '-', {'end': 30, 'label': 'Cultural', 'score': None, 'start': 17}, {'end': 31, 'label': 'Geographic', 'score': None, 'start': 17}]","['Western Culture', 'Western Culture']",['North America'],"['United States of America (USA)', 'United States of America (USA)']",CS,True,"প্রথমে, প্রভাব আইন (Law of Effect) অনুযায়ী নেতিবাচক পরিণতি একটি আচরণের ফলস্বরূপ ঘটে। এটি বোঝায় যে যখন একটি আচরণের ফলে নেতিবাচক পরিণতি ঘটে, তখন সেই আচরণটি ভবিষ্যতে কম ঘন ঘন ঘটবে।

দ্বিতীয়ত, নেতিবাচক পরিণতি আচরণকে দমন করে, অর্থাৎ এটি সেই আচরণকে কম করার জন্য কাজ করে। তাই, নেতিবাচক পরিণতি দ্বারা প্রভাবিত আচরণটি কম ঘন ঘন ঘটবে।

তৃতীয়ত, নেতিবাচক পরিণতি আচরণকে সম্পূর্ণরূপে বন্ধ করে দিতে পারে, তবে এটি নিশ্চিত নয় যে আচরণটি আর কখনও সঞ্চালিত হবে। তবে, এটি নিশ্চিত যে নেতিবাচক পরিণতি আচরণকে কম ঘন ঘন ঘটাতে সাহায্য করে।

অতএব, সঠিক উত্তর হল {'sol': 'b'}।",b
high_school_psychology/test/404,high_school_psychology,Social Sciences,"নিচের কোন ধরনের মস্তিষ্কের স্ক্যান এই বিবৃতিটিকে অপ্রমাণিত করতে সবচেয়ে কার্যকর হবে: ""বেশিরভাগ মানুষ তাদের মস্তিষ্কের মাত্র ১০ শতাংশ ব্যবহার করে""?",CAT,এমআরআই (MRI),EEG,PET,D,"['none', 'none', 'none', 'none']","['No', 'No', 'No', 'No']","['-', '-', '-', '-']",[],[],[],CA,True,"প্রথমে, আমি বিবৃতিটি বিশ্লেষণ করব। ""বেশিরভাগ মানুষ তাদের মস্তিষ্কের মাত্র ১০ শতাংশ ব্যবহার করে"" এই ধারণাটি একটি পৌরাণিক কাহিনী, এবং এটি প্রমাণিত করতে হবে যে এটি সঠিক নয়।

দ্বিতীয়ত, আমি বিভিন্ন ধরনের মস্তিষ্কের স্ক্যানের কার্যকারিতা বিবেচনা করব:
- CAT স্ক্যান (কম্পিউটেড অ্যাক্সিয়াল টমোগ্রাফি) সাধারণত মস্তিষ্কের গঠন এবং আকার দেখায়, কিন্তু এটি কার্যকলাপের তথ্য প্রদান করে না।
- এমআরআই (MRI) মস্তিষ্কের গঠন এবং টিস্যুর বিশদ চিত্র প্রদান করে, তবে এটি কার্যকলাপের তথ্যও সরবরাহ করে না।
- EEG (ইলেকট্রোএনসেফালোগ্রাম) মস্তিষ্কের বৈদ্যুতিক কার্যকলাপ রেকর্ড করে এবং এটি দেখাতে পারে যে ম",
high_school_psychology/test/419,high_school_psychology,Social Sciences,"মস্তিষ্কের বিকাশের একটি গবেষণায়, ইঁদুরের দুটি দলকে একটি পরীক্ষাগার সেটিংয়ে পালন করা হয়েছিল। গ্রুপ I-এ, প্রতিটি ইঁদুরকে কোনো খেলনা ছাড়াই বিচ্ছিন্নভাবে লালন-পালন করা হয়েছিল, যখন গ্রুপ II-তে, ইঁদুরগুলিকে ছোট ছোট দলে ভাগ করা হয়েছিল এবং খেলনার জন্য খেলনা দেওয়া হয়েছিল। নিম্নলিখিত বিবৃতিগুলির মধ্যে কোনটি এই গবেষণার সম্ভাব্য ফলাফলগুলিকে সবচেয়ে সঠিকভাবে প্রতিফলিত করে?",গ্রুপ I তে উত্থিত ইঁদুরের অগ্র মস্তিষ্ক থাকবে যার ওজন গ্রুপ II এ উত্থিত ইঁদুরের চেয়ে বেশি।,গ্রুপ I তে উত্থিত ইঁদুরের অগ্র মস্তিষ্ক থাকবে যার ওজন গ্রুপ II এ উত্থিত ইঁদুরের তুলনায় কম।,গ্রুপ I তে উত্থিত ইঁদুরের মস্তিষ্ক গ্রুপ II এ উত্থিত ইঁদুরের মস্তিষ্ক থেকে লক্ষণীয়ভাবে আলাদা হবে না।,"গ্রুপ I-এ উত্থিত ইঁদুরের মস্তিষ্কে আরও সাদা পদার্থ থাকবে, অন্যদিকে গ্রুপ II-এ উত্থিত ইঁদুরের মস্তিষ্ক আরও ধূসর পদার্থ নিয়ে গঠিত হবে।",B,"['none', 'none', 'none', 'none']","['No', 'No', 'No', 'No']","['-', '-', '-', '-']",[],[],[],CA,True,"প্রথমে, আমি গবেষণার উদ্দেশ্য এবং সেটিংস বুঝতে পারি। গ্রুপ I-এ ইঁদুরগুলোকে বিচ্ছিন্নভাবে এবং খেলনা ছাড়াই রাখা হয়েছে, যা তাদের সামাজিক এবং মানসিক উদ্দীপনা কমাতে পারে। অন্যদিকে, গ্রুপ II-তে ইঁদুরগুলোকে সামাজিকভাবে এবং খেলনার মাধ্যমে উদ্দীপিত করা হয়েছে, যা তাদের মস্তিষ্কের বিকাশে ইতিবাচক প্রভাব ফেলতে পারে।

দ্বিতীয়ত, আমি গবেষণার সম্ভাব্য ফলাফলগুলি বিশ্লেষণ করি। সাধারণত, সামাজিক এবং মানসিক উদ্দীপনা মস্তিষ্কের বিকাশের জন্য গুরুত্বপূর্ণ। তাই, গ্রুপ II-তে উত্থিত ইঁদুরের মস্তিষ্কের বিকাশ গ্রুপ I-এ উত্থিত ইঁদুরের তুলনায় ভালো হওয়ার সম্ভাবনা বেশি।

তৃতীয়ত, আমি প্রতিটি বিকল্পের বিশ্লেষণ করি:
a) গ্রুপ I তে উত্থিত ইঁদুরের অগ্র মস্তিষ্কের ওজন বেশি হবে, যা গবেষণার উদ্দেশ্যের সাথে সঙ্গতিপূর্ণ নয়।
b) গ্রুপ I তে উত্থিত ইঁদুরের অগ্র মস্তিষ্কের ওজন কম হবে, যা গবেষণার ফলাফলের সাথে সঙ্গতিপূর্ণ।
c) গ্রুপ I এবং II এর মস্তিষ্কের মধ্যে উল্লেখযোগ্য পার্থক্য হবে না, যা সম্ভব নয়।
d) সাদা এবং ধূসর পদার্থের মধ্যে পার্থক্য, যদিও এটি কিছুটা সম্ভব, তবে এটি গবেষণার মূল উদ্দেশ্যকে প্রতিফলিত করে না।

অতএব, সঠিক উত্তর হবে গ্রুপ I তে উত্থিত ইঁদুরের অগ্র মস্তিষ্কের ওজন গ্রুপ II তে উত্থিত ইঁদুরের তুলনায় কম হবে। তাই সঠিক উত্তর হল {'sol': 'b'}.",b
high_school_psychology/test/496,high_school_psychology,Social Sciences,জনসংখ্যার প্রায় কত শতাংশ WISC-তে ৭০ থেকে ১৩০ এর মধ্যে স্কোর করে?,34,50,68,৯৫,D,"['regional', 'none', 'regional', 'none']","['Yes', 'No', 'Yes', 'No']","['-', '-', '-', '-']",[],[],['United States of America (USA)'],CS,True,"প্রথমে, WISC (ওয়েইশলারের ইন্টেলিজেন্স স্কেল ফর চিলড্রেন) একটি মানসিক পরীক্ষার স্কেল যা সাধারণত গড় বুদ্ধিমত্তার স্কোর 100 এবং স্ট্যান্ডার্ড ডেভিয়েশন 15 নিয়ে কাজ করে। 

দ্বিতীয়ত, 70 থেকে 130 এর মধ্যে স্কোর করা মানে হল গড় স্কোরের এক স্ট্যান্ডার্ড ডেভিয়েশন নিচে (70) এবং এক স্ট্যান্ডার্ড ডেভিয়েশন উপরে (130) থাকা। 

তৃতীয়ত, সাধারণত, একটি গৌণ বিতরণে (normal distribution) প্রায় 68% জনসংখ্যা গড়ের এক স্ট্যান্ডার্ড ডেভিয়েশন (100 ± 15) এর মধ্যে স্কোর করে। 

অতএব, 70 থেকে 130 এর মধ্যে স্কোর করা জনসংখ্যার শতাংশ প্রায় 68%। 

সঠিক উত্তর হল {'sol': 'c'}।",c
high_school_psychology/test/501,high_school_psychology,Social Sciences,"মস্তিষ্কে যাওয়ার পথে, দুটি চোখের রেটিনা থেকে তথ্য ক্রস করে",অপটিক নার্ভ।,অপটিক চিয়াজম।,ফোবিয়া।,ল্যাটেরাল জেনিকুলেট নিউক্লিয়াস।,B,"['none', 'none', 'none', 'none']","['No', 'No', 'No', 'No']","['-', '-', '-', '-']",[],[],[],CA,True,"প্রথমে, আমি প্রশ্নের মূল বিষয়টি বুঝতে চেষ্টা করব। এখানে বলা হয়েছে যে মস্তিষ্কে যাওয়ার পথে, দুটি চোখের রেটিনা থেকে তথ্য ক্রস করে। 

দ্বিতীয়ত, আমি প্রতিটি বিকল্পের অর্থ বুঝতে চেষ্টা করব:
a) অপটিক নার্ভ: এটি চোখ থেকে মস্তিষ্কে তথ্য নিয়ে যাওয়ার জন্য দায়ী।
b) অপটিক চিয়াজম: এটি সেই স্থান যেখানে দুটি চোখের অপটিক নার্ভ ক্রস করে।
c) ফোবিয়া: এটি রেটিনার একটি অংশ, যেখানে দৃষ্টি সবচেয়ে তীক্ষ্ণ হয়।
d) ল্যাটেরাল জেনিকুলেট নিউক্লিয়াস: এটি মস্তিষ্কের একটি অংশ যা দৃষ্টির তথ্য প্রক্রিয়া করে।

তৃতীয়ত, আমি বুঝতে পারি যে প্রশ্নে উল্লেখিত ""তথ্য ক্রস করা"" শব্দটি অপটিক চিয়াজমের সাথে সম্পর্কিত, কারণ এটি সেই স্থান যেখানে দুটি চোখের তথ্য একত্রিত হয় এবং ক্রস করে।

অতএব, সঠিক উত্তর হল {'sol': 'b'}.",b
